<?xml version="1.0" encoding="utf-8"?>
<?xml-stylesheet type="text/xsl" href="renderHTML.xsl"?>
<!DOCTYPE class PUBLIC "-//TerraSwarm//DTD Accessor 1//EN"
    "https://www.icyphy.org/accessors/obsolete/Accessor_1.dtd">
<class name="Weather" extends="org.terraswarm.JSAccessor">
  <version>0.1 $Date$</version>
  <author>Alex Mead and Edward A. Lee</author>
  <input
    name="longitude"
    value="-122.26"
    type="number"
    description="The longitude of a location (default is Berkeley)."/>
  <input
    name="latitude"
    value="37.85"
    type="number"
    description="The latitude of a location (default is Berkeley)."/>
  <output
    name="temperature"
    type="number"
    description="Temperature in degrees celsius."/>       
  <output
    name="relativeHumidity"
    type="number"
    description="Relative humidity (percent)."/>       
  <output
    name="name"
    type="string"
    description="Name of the location (nearest city name)."/>       
  <output
    name="pressure"
    type="number"
    description="Pressure in hectopascals (hPa), where 1 hPa is 100 pascals."/>       
  <output
    name="windSpeed"
    type="number"
    description="Wind speed (meters per second)."/>       
  <output
    name="windDirection"
    type="number"
    description="Wind source direction (in degrees, relative to north)."/>       
  <description type="text/html">
    <![CDATA[
This accessor, when fired, reads the current weather data from
<a href="http://openweathermap.org">openweathermap.org</a>.
	]]>
  </description>
  <script type="text/javascript">
    // <![CDATA[
	function fire() {
        var lat = get('latitude');
        var lon = get('longitude');
        var url = "http://api.openweathermap.org/data/2.5/weather?lat="
                + lat
                + "&lon=" + lon;
        var record = readURL(url);
        var json = JSON.parse(record);
        var temp = (parseFloat(json.main.temp) - 273.15);
        var humidity = parseFloat(json.main.humidity);
        var pres = parseFloat(json.main.pressure);
        var ws = parseFloat(json.wind.speed);
        var wd = parseFloat(json.wind.deg);
        
        // Send outputs
        send('windDirection', wd);
        send('windSpeed', ws);
        send('name', json.name);
        send('pressure', pres);
        send('temperature', temp);
        send('relativeHumidity', humidity);
	}
	// ]]>
  </script>
</class>
